[
  {
    "player_id": "1630173",
    "injury_risk": 28,
    "volatility": 49,
    "minutes_risk": 13
  },
  {
    "player_id": "203500",
    "injury_risk": 33,
    "volatility": 41,
    "minutes_risk": 13
  },
  {
    "player_id": "1628389",
    "injury_risk": 26,
    "volatility": 28,
    "minutes_risk": 37
  },
  {
    "player_id": "1630534",
    "injury_risk": 35,
    "volatility": 45,
    "minutes_risk": 9
  },
  {
    "player_id": "1630583",
    "injury_risk": 38,
    "volatility": 39,
    "minutes_risk": 10
  },
  {
    "player_id": "1629638",
    "injury_risk": 32,
    "volatility": 36,
    "minutes_risk": 11
  },
  {
    "player_id": "1628960",
    "injury_risk": 25,
    "volatility": 30,
    "minutes_risk": 18
  },
  {
    "player_id": "1628386",
    "injury_risk": 28,
    "volatility": 29,
    "minutes_risk": 30
  },
  {
    "player_id": "1630631",
    "injury_risk": 38,
    "volatility": 41,
    "minutes_risk": 10
  },
  {
    "player_id": "203937",
    "injury_risk": 20,
    "volatility": 53,
    "minutes_risk": 3
  },
  {
    "player_id": "203507",
    "injury_risk": 28,
    "volatility": 32,
    "minutes_risk": 30
  },
  {
    "player_id": "203648",
    "injury_risk": 32,
    "volatility": 60,
    "minutes_risk": 5
  },
  {
    "player_id": "1630175",
    "injury_risk": 38,
    "volatility": 29,
    "minutes_risk": 8
  },
  {
    "player_id": "1628384",
    "injury_risk": 36,
    "volatility": 59,
    "minutes_risk": 31
  },
  {
    "player_id": "1630166",
    "injury_risk": 39,
    "volatility": 19,
    "minutes_risk": 29
  },
  {
    "player_id": "1629028",
    "injury_risk": 39,
    "volatility": 44,
    "minutes_risk": 31
  },
  {
    "player_id": "1628963",
    "injury_risk": 33,
    "volatility": 75,
    "minutes_risk": 12
  },
  {
    "player_id": "1630163",
    "injury_risk": 23,
    "volatility": 57,
    "minutes_risk": 36
  },
  {
    "player_id": "1628366",
    "injury_risk": 39,
    "volatility": 53,
    "minutes_risk": 34
  },
  {
    "player_id": "1631094",
    "injury_risk": 34,
    "volatility": 52,
    "minutes_risk": 26
  },
  {
    "player_id": "1630217",
    "injury_risk": 35,
    "volatility": 36,
    "minutes_risk": 38
  },
  {
    "player_id": "1631230",
    "injury_risk": 21,
    "volatility": 80,
    "minutes_risk": 18
  },
  {
    "player_id": "203084",
    "injury_risk": 30,
    "volatility": 14,
    "minutes_risk": 6
  },
  {
    "player_id": "1630567",
    "injury_risk": 20,
    "volatility": 27,
    "minutes_risk": 10
  },
  {
    "player_id": "1629628",
    "injury_risk": 30,
    "volatility": 59,
    "minutes_risk": 24
  },
  {
    "player_id": "1629646",
    "injury_risk": 27,
    "volatility": 80,
    "minutes_risk": 10
  },
  {
    "player_id": "1642419",
    "injury_risk": 33,
    "volatility": 90,
    "minutes_risk": 2
  },
  {
    "player_id": "201587",
    "injury_risk": 22,
    "volatility": 50,
    "minutes_risk": 6
  },
  {
    "player_id": "1630180",
    "injury_risk": 37,
    "volatility": 44,
    "minutes_risk": 15
  },
  {
    "player_id": "1629048",
    "injury_risk": 27,
    "volatility": 52,
    "minutes_risk": 19
  },
  {
    "player_id": "202687",
    "injury_risk": 20,
    "volatility": 80,
    "minutes_risk": 17
  },
  {
    "player_id": "1641710",
    "injury_risk": 36,
    "volatility": 63,
    "minutes_risk": 8
  },
  {
    "player_id": "203992",
    "injury_risk": 24,
    "volatility": 56,
    "minutes_risk": 6
  },
  {
    "player_id": "1641737",
    "injury_risk": 23,
    "volatility": 91,
    "minutes_risk": 5
  },
  {
    "player_id": "1626164",
    "injury_risk": 34,
    "volatility": 32,
    "minutes_risk": 44
  },
  {
    "player_id": "1628449",
    "injury_risk": 32,
    "volatility": 38,
    "minutes_risk": 9
  },
  {
    "player_id": "1628396",
    "injury_risk": 32,
    "volatility": 71,
    "minutes_risk": 6
  },
  {
    "player_id": "1631103",
    "injury_risk": 21,
    "volatility": 57,
    "minutes_risk": 11
  },
  {
    "player_id": "1631128",
    "injury_risk": 20,
    "volatility": 42,
    "minutes_risk": 19
  },
  {
    "player_id": "1628969",
    "injury_risk": 32,
    "volatility": 29,
    "minutes_risk": 57
  },
  {
    "player_id": "1628970",
    "injury_risk": 33,
    "volatility": 26,
    "minutes_risk": 33
  },
  {
    "player_id": "1628415",
    "injury_risk": 34,
    "volatility": 35,
    "minutes_risk": 25
  },
  {
    "player_id": "1628971",
    "injury_risk": 26,
    "volatility": 63,
    "minutes_risk": 1
  },
  {
    "player_id": "1627759",
    "injury_risk": 33,
    "volatility": 31,
    "minutes_risk": 32
  },
  {
    "player_id": "1641738",
    "injury_risk": 28,
    "volatility": 84,
    "minutes_risk": 5
  },
  {
    "player_id": "1628973",
    "injury_risk": 34,
    "volatility": 24,
    "minutes_risk": 25
  },
  {
    "player_id": "1628418",
    "injury_risk": 36,
    "volatility": 59,
    "minutes_risk": 10
  },
  {
    "player_id": "202710",
    "injury_risk": 29,
    "volatility": 58,
    "minutes_risk": 0
  },
  {
    "player_id": "1641824",
    "injury_risk": 32,
    "volatility": 82,
    "minutes_risk": 12
  },
  {
    "player_id": "1631288",
    "injury_risk": 29,
    "volatility": 88,
    "minutes_risk": 16
  },
  {
    "player_id": "203484",
    "injury_risk": 29,
    "volatility": 19,
    "minutes_risk": 6
  },
  {
    "player_id": "1641739",
    "injury_risk": 37,
    "volatility": 63,
    "minutes_risk": 12
  },
  {
    "player_id": "203991",
    "injury_risk": 38,
    "volatility": 31,
    "minutes_risk": 6
  },
  {
    "player_id": "1642382",
    "injury_risk": 33,
    "volatility": 95,
    "minutes_risk": 6
  },
  {
    "player_id": "1642267",
    "injury_risk": 24,
    "volatility": 82,
    "minutes_risk": 8
  },
  {
    "player_id": "1628975",
    "injury_risk": 38,
    "volatility": 36,
    "minutes_risk": 14
  },
  {
    "player_id": "1628976",
    "injury_risk": 38,
    "volatility": 37,
    "minutes_risk": 22
  },
  {
    "player_id": "1627936",
    "injury_risk": 25,
    "volatility": 42,
    "minutes_risk": 3
  },
  {
    "player_id": "1642264",
    "injury_risk": 26,
    "volatility": 85,
    "minutes_risk": 17
  },
  {
    "player_id": "1630658",
    "injury_risk": 38,
    "volatility": 93,
    "minutes_risk": 14
  },
  {
    "player_id": "1630577",
    "injury_risk": 32,
    "volatility": 52,
    "minutes_risk": 6
  },
  {
    "player_id": "1630551",
    "injury_risk": 30,
    "volatility": 82,
    "minutes_risk": 8
  },
  {
    "player_id": "1631108",
    "injury_risk": 35,
    "volatility": 42,
    "minutes_risk": 15
  },
  {
    "player_id": "1631321",
    "injury_risk": 32,
    "volatility": 90,
    "minutes_risk": 19
  },
  {
    "player_id": "1641740",
    "injury_risk": 25,
    "volatility": 94,
    "minutes_risk": 18
  },
  {
    "player_id": "1629634",
    "injury_risk": 21,
    "volatility": 42,
    "minutes_risk": 0
  },
  {
    "player_id": "203903",
    "injury_risk": 27,
    "volatility": 40,
    "minutes_risk": 0
  },
  {
    "player_id": "1629651",
    "injury_risk": 26,
    "volatility": 31,
    "minutes_risk": 27
  },
  {
    "player_id": "1642270",
    "injury_risk": 25,
    "volatility": 87,
    "minutes_risk": 10
  },
  {
    "player_id": "1641730",
    "injury_risk": 20,
    "volatility": 86,
    "minutes_risk": 2
  },
  {
    "player_id": "1629599",
    "injury_risk": 34,
    "volatility": 33,
    "minutes_risk": 10
  },
  {
    "player_id": "1642268",
    "injury_risk": 27,
    "volatility": 87,
    "minutes_risk": 8
  },
  {
    "player_id": "1628381",
    "injury_risk": 24,
    "volatility": 40,
    "minutes_risk": 13
  },
  {
    "player_id": "1628380",
    "injury_risk": 35,
    "volatility": 56,
    "minutes_risk": 2
  },
  {
    "player_id": "1626192",
    "injury_risk": 35,
    "volatility": 41,
    "minutes_risk": 8
  },
  {
    "player_id": "1641731",
    "injury_risk": 24,
    "volatility": 74,
    "minutes_risk": 20
  },
  {
    "player_id": "1630595",
    "injury_risk": 38,
    "volatility": 48,
    "minutes_risk": 24
  },
  {
    "player_id": "201939",
    "injury_risk": 20,
    "volatility": 33,
    "minutes_risk": 10
  },
  {
    "player_id": "1630700",
    "injury_risk": 33,
    "volatility": 50,
    "minutes_risk": 1
  },
  {
    "player_id": "1631120",
    "injury_risk": 31,
    "volatility": 97,
    "minutes_risk": 13
  },
  {
    "player_id": "201942",
    "injury_risk": 38,
    "volatility": 18,
    "minutes_risk": 22
  },
  {
    "player_id": "1628978",
    "injury_risk": 24,
    "volatility": 33,
    "minutes_risk": 24
  },
  {
    "player_id": "1631217",
    "injury_risk": 23,
    "volatility": 76,
    "minutes_risk": 17
  },
  {
    "player_id": "1641711",
    "injury_risk": 23,
    "volatility": 72,
    "minutes_risk": 18
  },
  {
    "player_id": "1631172",
    "injury_risk": 23,
    "volatility": 77,
    "minutes_risk": 9
  },
  {
    "player_id": "1642265",
    "injury_risk": 37,
    "volatility": 92,
    "minutes_risk": 6
  },
  {
    "player_id": "1629029",
    "injury_risk": 33,
    "volatility": 59,
    "minutes_risk": 56
  },
  {
    "player_id": "1629652",
    "injury_risk": 34,
    "volatility": 30,
    "minutes_risk": 27
  },
  {
    "player_id": "1630245",
    "injury_risk": 28,
    "volatility": 29,
    "minutes_risk": 25
  },
  {
    "player_id": "203083",
    "injury_risk": 34,
    "volatility": 33,
    "minutes_risk": 19
  },
  {
    "player_id": "1627739",
    "injury_risk": 32,
    "volatility": 55,
    "minutes_risk": 9
  },
  {
    "player_id": "1642346",
    "injury_risk": 27,
    "volatility": 86,
    "minutes_risk": 14
  },
  {
    "player_id": "201142",
    "injury_risk": 25,
    "volatility": 52,
    "minutes_risk": 16
  },
  {
    "player_id": "1631105",
    "injury_risk": 36,
    "volatility": 48,
    "minutes_risk": 13
  },
  {
    "player_id": "1631106",
    "injury_risk": 38,
    "volatility": 63,
    "minutes_risk": 13
  },
  {
    "player_id": "1641744",
    "injury_risk": 31,